spdb9698	对自律机制成员的人民币汇率中间价报价行为、银行间外汇市场交易行为和银行外汇及跨境人民币柜台市场交易行为等三项行为
spdb9699	用于自律机制成员的分层和遴选
spdb9700	财务约束、中间价报价情况、银行间市场交易规范情况和外汇和跨境人民币展业规范情况等4个模块
spdb9708	指债务人按规定借用外债时，应按照规定方式向所在地外汇局登记或报送外债的签约、提款、偿还和结售汇等信息。
spdb9709	1.银行办理外债业务，应严格按照“了解你的客户、了解你的业务、尽职审查”的展业原则，根据客户分类情况，履行尽职审查责任，确保客户身份及业务背景真实、合规。 2.银行应重点关注异常和可疑交易，对于交易背景存疑、大额高频交易等情况以及关注客户，应执行更严格的单证审核标准，强化尽职审查措施。
spdb9710	银行在为客户办理外债开户、提款、结汇、境内划转或支付、境外支付及还本付息等业务，应通过资本项目信息系统进行信息核对，并严格按照外汇管理规定对材料的真实性及一致性进行合理审查。
spdb9717	(
spdb9719	（了解客户、了解业务、尽职审查）、“三反”(反洗钱、反恐融资、反逃税)等要求以及“真实性”、“合规性”、“审慎性”的层层递进逻辑关系原则，不断完善内控制度和业务操作流程，审慎开展外汇业务。
spdb9720	（一）银行在为申请人办理境内直接投资项下 的各项外汇业务，包括为境内直接投资所涉主体办理外汇登记、账户开立、资金入账和资金使用等业务时，应当对客户进行识别。 （二）查询外汇局资本项目信息系统，确认客户是否按规定报送直接投资存量权益数据，确保客户未被业务管控。 （三）审核境内机构相关合法注册文件及商务主管部门或国有资产管理部门或财政部门相关文件，确保申请业务所需材料真实、合法、合规、齐全。
spdb9727	除按《总则》标准确定的关注客户外，满足以下条件之一的，可列为“关注客户”：1.存在高度关联关系（如公司实际控制人存在关联关系、注册地址相近、联系方式存在关联等）的企业。 2.本地注册但本地无固定经营办公场所、情况不明的企业。 3.辅导期企业。 4.业务量异常（如突然增加或减少、与注册资本严重背离等）或结算方式、贸易商品、交易对手等明显变化的企业。 5.注册地为异地的企业。 6.贸易融资存在异常情况。
spdb9728	“谁出口谁收汇、谁进口谁付汇”原则
spdb9729	包括海关电子口岸系统、监测系统、仓储公司、国际提单查询机构、船公司、行业协会等网站及实地查访、海外联行或母行、本行其他分支机构、其他从事相同或类似交易的本行其他客户等
spdb9730	办理货物贸易进口，购汇及支付货款。
spdb9737	国际银行间外汇市场开盘及收盘时间为：悉尼时间星期一上午 5:00 点至纽约时间星期五下午 17:00 点(北京时 间：星期一上午 3:00 点至星期六上午 5:00 点 )，法定假期除 外。
spdb9738	指市场参与者之间通过中国外汇交易中 心（以下简称“交易中心”）进行人民币与外币交易的场所，包 括人民币外汇市场和外币对市场。交
spdb9740	1) 市场参与者进入银行间外汇市场交易应满足规定的资 格条件并获得银行间外汇市场相应会员资格。 2) 市场参与者在进行人民币外汇衍生产品交易业务前应 确认已与交易对手方签署相关衍生产品交易协议，交易人员不 得以个人名义与交易对手方签署私下协议。 3) 交易员应具备所在机构专业岗位任职要求及交易中心 颁发的交易员资格证书，服从交易中心对交易员资格考试、证 书发放及后续管理等工作的组织安排。交易员从事银行间外汇 市场交易及相关业务或登录交易系统时应使用真实身份或实名 用户。机构不得指派未取得交易员资格的人员从事交易相关业 务或使用交易系统。 4) 机构应在交易员上岗前及时向交易中心办理登记手 续。交易员离职或解除劳动合同，原所在机构应及时向交易中 - 5 - 心办理变更登记手续。
spdb9747	1.识别借款人及项目所在地国别风险、涉及的法律风险。 2.审核借款人信用状况、经营状况、财务状况等相关情况，对借款人、担保人等相关参与方偿债能力进行分析。 3.审核借款人是否存在多元化经营、成立时间短与其贷款资金及融资项目不相符、借款用途是否存在偏离主业、借款资金是否远超经营规模等情形。 4.审核融资项目是否符合信贷政策要求；审核业务背景真实性，防止虚假贸易和资金挪用。 5.审核融资项目建设的必要性、合规性和合理性、项目建设的进度是否符合行业特点和商业惯例等相关情况，以判断是否与贷款用途和资金相符及贷款资金的合理必要性。 6.密切跟进其贷款用途是否与其计划相符、还款进度相符。 7.审核客户全融资情况，避免形成对同一个项目的重复融资、多头融资或超额授信。
spdb9748	银行在发放境外贷款后，应进行持续监控，跟进资金流向，关注币种及期限错配风险，避免对还贷资金来源产生的不利影响；对于“关注客户”应拓宽信息核实渠道，通过行业协会、境内外关联行、第三方机构等途径加强客户追踪调查。必要时，可通过要求客户追加担保或抵押物，提前收回贷款等措施化解风险。
spdb9750	银行对进出口商提供的与进出口贸易相关的短期融资或信用便利。
spdb9757	是指进口付汇或出口收汇完成后，因实际需要退回原付款方或收款方。
spdb9758	推动银行同业执行《中华人民共和国外汇管理条例》等外汇管理规定，统一银行外汇业务展业原则标准，完善真实性审核，维护市场公平竞争
spdb9759	《银行外汇业务展业原则》包括总则和各项外汇业务展业规范。
spdb9760	银行为客户办理外汇业务时，需遵循的“了解客户”、“了解业务”和“尽职审查”原则，包括采取有效措施调查客户背景、尽职审查交易的真实性和合规性，审慎办理外汇业务。
spdb9767	由银行间外汇市场成员组成的市场自律和协调机制，在符合国家有关汇率政策和外汇管理规定的前提下，对人民币汇率中间价报价行为，以及银行间市场和银行柜台市场交易行为进行自律管理，维护市场正当竞争秩序，促进外汇市场有序运作和健康发展。
spdb9768	具有人民币兑美元汇率中间价报价资格的银行。
spdb9769	目前包括中国工商银行，中国农业银行，中国银行，中国建设银行，交通银行，中信银行，招商银行，上海浦东发展银行，兴业银行，花旗银行（中国），汇丰银行（中国），渣打银行（中国），三菱东京日联银行（中国）和蒙特利尔银行（中国）等14家银行。
spdb9770	（一）全面性原则。报价自律规范贯穿报价上传、报价形成和报价运用全过程，覆盖所有报价行。 （二）客观性原则。各报价行应如实将报价有关情况报外汇市场自律机制秘书处备案，外汇市场自律机制秘书处应根据本规范要求客观公正地地对报价行报价情况进行评估。外汇市场自律机制秘书处对掌握的报价行涉密信息承担保密责任。 （三）适应性原则。
spdb9777	因公出国和日常涉外交往（以下简称“外事”）。
spdb9778	是指因公出国参加会议、执行工作访问、从事业务交流和参加培训等公务活动，外事是指以公务身份与国际组织、境外（包括香港、澳门地区）机构、在华外资机构及相关人士的联系和往来。
spdb9779	自律机制开展国际交流的协调机构
spdb9780	负责自律机制国际交流工作的统筹协调； （二）协调自律机制与外方的沟通联络； （三）协助全国自律机制各成员行和省级自律机制更好地开展国际交流与合作； （四）汇总自律机制国际交流相关资料和信息，编写国际交流情况简报； （五）其他工作。
spdb9787	境内机构在境外投资设立项目或企业前，需要向境外支付与境外直接投资有关的费用。
spdb9788	1.收购境外企业股权或境外资产权益，按项目所在地法律规定或出让方要求需缴纳的保证金； 2.在境外项目招标过程中，需支付的投标保证金； 3.开展境外直接投资前，进行市场调查、租购办公场地和设备、聘用人员，以及聘请境外中介机构提供服务所需的费用。
spdb9789	（1）《境外直接投资外汇登记业务申请表》； （2）营业执照和组织机构代码证（三证合一的，提供新版营业执照）； （3）涉及国有企业境外投资的，还需提交国有资产管理部门或财政部门的批准文件； 关注客户除提供上述（1）～（3）项材料外，还应提供： （4）已向境外直接投资机构主管部门报送的书面申请及境内机构参与投标、并购或合资合作项目的相关真实性证明材料，如并购协议、境外项目投标书、租赁合同、劳务合同等。
spdb9790	适用于经我国监管部门批准从事外汇交易业务的机构及其内部从业人员，包括具有银行间外汇市场业务、结售汇业务、外币买卖业务等资格的经营机构及其内部从业人员。
spdb9797	一切必要措施，防止欺诈和其他犯罪活动。管理层和员工应当特别警惕下列情形：1.	发现交易以无需记录或未能按规范流程记录的方式进行； 2.	收到交易对手方异常的清算指令； 3.	发现收取资金的一方为相关交易对手方以外的第三方； 4.	在交易完成后无法确认交易的细节； 5.	在交易中出现异常。
spdb9798	市场参与者是否已同意将该客户信息纳入到敏感信息的范畴或已同意采取更严格的信息管控。 包括但不限于：对具体客户交易的头寸、心态或意愿的了解。 建议市场参与者定期对敏感信息的识别进行核查。
spdb9800	为完善省级外汇业务展业工作自律机制（以下简称省级机制），督促银行落实展业自律要求，促进外汇市场健康有序发展，防范跨境资金异常流动风险
spdb9808	为规范询价市场交易行为，保护市场参与者的合法权益。
spdb9809	1. 经上海黄金交易所（以下简称“交易所”）核准的市场参与 者，通过交易所提供的询价交易系统（以下简称“交易所询价系统”）， 以双边询价方式达成的交易。 2. 经交易所核准的市场参与者，通过中国外汇交易中心（以下 简称“交易中心”）外汇交易系统以双边询价方式进行的交易，交易 品种为交易所指定在交易中心外汇交易系统挂牌的交易品种。 
spdb9817	为规范上海黄金交易所（以下简称“金交所”）黄金 ETF 认购、申购、赎回业务，维护投资者及基金持有人合法权
spdb9818	适用于投资者通过具备黄金 ETF 认购申购赎回 代办资格的金交所会员代理黄金 ETF 现货实盘合约认购、 申购、赎回业务或金交所会员自营黄金 ETF 现货实盘合约 认购、申购、赎回业务。
spdb9827	为规范上海黄金交易所黄金拆借业务秩序，保护市 场参与机构的合法权益
spdb9828	是指上海黄金交易所（以下简称“交易所”） 核准的市场参与机构，通过交易所询价系统以双边询价方式进行拆 入、拆出的黄金融通业务。
spdb9829	交易所负责在中国人民银行的监管下组织黄金拆借 交易的集中交易、清算和交割，包括但不限于挂牌拆借品种、制 定相关市场规则、管理监督市场准入与日常运行、发布市场信息、 核定交易参数以及交易权限等。
spdb9830	为每周一至周五9:00-11:30及 13:30-17:00（交易所公告休市日除外），11:30-13:30为暂停交 易状态。
spdb9838	有AUX.CNY、AUY.CNY，分别对应成色不低于99.95％和不低于99.99％的黄金交易标的。新增其他贵金属询价交易品种的挂牌根据交易所的公告执行。
spdb9839	（一）即期交易以全价报价，报价以人民币元/克为单位，精确到小数点后两位；（二）远期和掉期交易以远期/掉期点（浮点数）报价，远期/掉期点以人民币分/克为单位，精确到小数点后一位，可以为 4正也可以为负。远期交易全价为即期价格加相应期限远期点。掉期交易全价为即期价格加相应期限掉期点，分为近端掉期全价和远端掉期全价。
spdb9840	基准价上下指定比例的涨跌幅限制，黄金询价即期交易成交价可在交易所当日公布基准价上下15%的幅度内波动。AUX.CNY和AUY.CNY交易品种分别采用前一交易日交易所竞价市场Au9995和Au9999合约的收盘价作为当日基准价。交易所将根据市场行情适时调整公告涨跌幅度
spdb9847	是指双方约定的，符合上海黄金交易所认可的交割质量标准的黄金实物，包括但不限于经交易所认定的可 提供标准金锭、金条企业生产的符合交易所金锭 SGEB1-2002、 金条 SGEB2-2004 质量标准的实物，及伦敦金银市场协会(LBMA) 认定的合格供货商生产的标准实物。
spdb9848	上海黄金交易所挂牌交易和交割的实物黄金品种，如 AU9995、AU9999、AU995 等。
spdb9849	按照上海黄金交易所的有关规定，实物黄金分为“买入货 权”或“某金库剩余库存”的属性。
spdb9850	借出方将租借的黄金过户交付至借入方的日期。
spdb9857	金条±0.05 克（含）内，金锭 为±0.1 克（含）内，铂锭为±0.2 克（含）内，银锭为±1 克 （含）内。
spdb9858	《上海黄金交易所出库申请单》（原件，一式三联，加盖会员单 位业务用章，国际会员可由负责人签字）、上海黄金交易所提货 申请单、USB-KEY（国际会员及国际客户可以不提供）、提货人有 效身份证件。 
spdb9859	1. 当月 1 日到结算日，仓储费天数＝结算日日期－当天日 期＋1 2. 上月结算日后第二天到月末，仓储费天数＝每月计算积 数的天数－（当天日期－结算日日期）＋
spdb9860	支付质检及相关费用；  17  （二）承担由此发生的经济损失。 
spdb9867	指买入黄金。
spdb9868	《银行间黄金询价业务产品指引》所指的卖出指卖出黄金。
spdb9869	指做市商或报价方为买入黄金而报出的价格。
spdb9870	黄金交易实际达成交易的价格。
spdb9877	《关于加强银行业金融机构黄金市场业务管理有关事项的通知》规定城市商业银行、农村商业银行、农村合作银行、城市信用合作社、农村信用合作社拟开办黄金市场业务，应由其法人机构向注册地所属中国人民银行上海总部、各分行、营业管理部、省会(首府)城市中心支行
spdb9878	自开展黄金市场业务的次月起，应定期向中国人民银行报送如下材料:   (一)每季度的前10个工作日内，报送上季度黄金市场业务开展情况的报告;   (二)每年1月末前报送上年度黄金市场业务开展情况的报告;   (三)每月前5个工作日内报送上月黄金市场业务监测数据报表
spdb9887	黄金（Au）、白银（Ag）、铂金（Pt），以及其他经中国人民银行批准的品种
spdb9897	千克、成色不低于99.99％的金锭；标准重量12.5千克、成色不低于99.5％的金锭；标准重量0.1千克、成色不低于99.99％的金条。
spdb9898	（一）以自己为交易对象，大量或者多次进行自买自卖；（二）实际控制关系账户之间大量或多次进行互为对手方的交易；（三）日内出现频繁申报并撤销申报，可能影响交易价格或误导其他客户进行交易的行为；（四）日内出现大量或多次大额申报并撤销申报，可能影响交易价格或者误导其他客户进行交易的行为；（五）实际控制关系账户合并持仓超过交易所持仓限额规定；（六）特定交易对手之间大量或者多次进行高买低卖交易；（七）通过计算机程序自动批量下单、快速下单影响交易所系统安全或者正常交易秩序；（八）交易所认定的其他情形。
spdb9899	（一）地震、水灾、火灾、战争、罢工等不可抗力或技术故障 等不可归责于交易所的原因导致交易无法正常进行； （二）会员无法完成结算或交割，对市场正在产生或者将产生 重大影响； （三）出现连续单边市的情况并采取相应措施后仍未化解风险； （四）交易所规定的其他情况。
spdb9900	交易合约的开盘价、最高价、最低价、最新价、收盘价、结算 价、涨跌、成交量、成交金额、持仓量、交收量以及其他需要公布 的信息。
spdb9907	拆借利息清算顺序在竞价交易与其他询价交易之后，即清算顺序在前的交易品种所得资金可用于拆借利息清算。对于委托交易所进行利息清算的黄金拆借交易，交易所在每一交易日16:00之后日终清算交割时按照净额原则进行利息清算，对市场参与机构同一付息日的黄金拆借交易进行收付轧差，并按照收付轧差后的资金净额进行利息清算。若市场参与机构可用资 金不足，交易所系统将根据交易达成时间，自后往前逆序逐笔判定该机构需在当日支付利息的拆借交易为利息清算失败，直至其可用资金能够满足利息清算需求。对于被交易所系统判定为利息清算失败的拆借交易，交易所将不予利息清算，利息清算失败不影响交易所系统根据原交易要素进行黄金实物交割操作。
spdb9908	（一）借金过户失败交易所系统不再处理此类交易后续的利息支付和到期还金事宜，交易双方根据交易所系统相关责任认定信息自行协商处理 方法。（二）还金过户失败（1）提前还金过户失败的交易，按照本细则第十六条执行；（2）到期主动还金过户失败的交易，交易所系统在到期当日16：00之后日终清算交割时将再自动进行一次还金过户处理；（3）到期自动还金过户失败的交易，交易双方根据交易所系统相关责任认定信息自行协商处理方法。交易双方经协商继续履行原交易的，交易所可根据双方书面申请再次进行还金交割处理。（4）还金过户失败不影响交易所系统根据相关交易要素继续进行利息清算。
spdb9917	交割交易是指交易双方在到期日按照约定要素根据钱货两讫 原则进行资金清算与实物交割的交易。现金差额交割交易是指交易双方在到期日根据约定的交易价格 与参考价格轧差后对现金差额进行资金清算的交易。 第十条 现金差额交割交易的参考价格是交易双方指定日期的收 盘价、开盘价、加权平均价、基准价等交易所公开的市场价格或交易 双方约定的其他价格。 第十一条 现金差额=（交易价格-参考价格）×交易重量。差额为 正值，则买方应向卖方支付相应金额；差额为负值，则卖方应向买方 支付相应金额；差额为零，交易双方无需进行资金收付。 第十二条 LAu9999、LAu9995、iLAu9999、iLAu995、iLAu100g 的 交易类型为拆借交易，按照《上海黄金交易所黄金拆借业务交易规则》 与《上海黄金交易所拆借业务交易细则》执行。 第十三条 新增或调整交易品种及其相关参数，按照交易所的公告执行。  
spdb9918	交割的内容是：第十四条 会员应委托交易所进行实物交割询价交易的资金清算 与实物交割。交易所根据委托提供资金清算与实物交割服务，但不承 继交易双方交易项下的权利和义务。 第十五条 交易双方达成现金差额交割询价交易时需选择
spdb9928	在受理国际客户代理业务申请时，应当对 国际客户进行充分的风险揭示，并对国际客户进行风险测试，评 估国际客户的风险承受能力。根据评估结果对国际客户进行分级 管理，对风险承受能力差的国际客户应当不予开户。
spdb9929	（一） 该国际客户的营业执照复印件； （二） 该国际客户的组织机构代码证复印件； （三） 该国际客户的税务登记证复印件； （四） 该国际客户的法人或者负责人的身份证明文件复印 件； （五） 交易所和国际中心规定的其他材料
spdb9930	（一） 该国际客户在境外合法注册成立的证明文件复印件； （二） 该国际客户的负责人有效身份证件复印件，包括法 定代表人、单位负责人；授权他人办理的，还应出具被授权人的 有效身份证件复印件及负责人签字的授权书原件； （三） 最近一年经审计的财务报告或验资报告 （四） 交易所和国际中心规定的其他材料。
spdb9937	第三条 具有上海黄金交易所（以下简称“交易所”）交易席位的 机构，可向交易所提交开展询价业务（不含银行间询价业务）的书面 备案报告，格式见附表 1《上海黄金交易所询价业务权限备案表》。 备案机构经交易所核准，方可开展询价自营业务与代理业务。交易所 暂不开放国际会员代理业务权限。 第四条 会员开展询价代理业务，应坚持符合国家相关产业政策、 风险可控和审慎等原则，服务实体经济。 第五条 机构客户参与交易所询价业务，应委托其代理会员进行询 价交易。客户与会员应签署询价业务委托代理协议，明确双方的权利 与义务，协议应至少包括客户授权会员代理交易、授权会员代理资金清算、授权会员申报交易违约等内容。 个人客户不能参与询价业务。
spdb9938	交割交易是指交易双方在到期日按照约定要素根据钱货两讫 原则进行资金清算与实物交割的交易。 现金差额交割交易是指交易双方在到期日根据约定的交易价格 与参考价格轧差后对现金差额进行资金清算的交易。 第十条 现金差额交割交易的参考价格是交易双方指定日期的收 盘价、开盘价、加权平均价、基准价等交易所公开的市场价格或交易 双方约定的其他价格。 第十一条 现金差额=（交易价格-参考价格）×交易重量。差额为 正值，则买方应向卖方支付相应金额；差额为负值，则卖方应向买方 支付相应金额；差额为零，交易双方无需进行资金收付。 第十二条 LAu9999、LAu9995、iLAu9999、iLAu995、iLAu100g 的 交易类型为拆借交易，按照《上海黄金交易所黄金拆借业务交易规则》 与《上海黄金交易所拆借业务交易细则》执行。 第十三条 新增或调整交易品种及其相关参数，按照交易所的公告 执行。 
spdb9939	（一）“交易所清算”模式下，交易双方委托交易所进行资金清 算，交易所根据委托提供现金差额计算、资金划付等清算服务，但不 承继交易双方交易项下的权利义务。 （二）“非交易所清算”模式下，现金差额清算由交易双方自行 完成，交易所不进行差额计算、资金划付等清算处理。 第十六条 询价交易于每交易日 16：00 参与交易所资金清算与实 物交割。该时点之后不可达成当日到期的交易。 第十七条 交易所于每一交易日 16：00 后按照现货实盘交易、现 货即期交易、现货延期交易、询价交易（含银行间询价交易）的清算 交割顺序进行日终清算，即资金实物首先满足现货实盘、现货即期、 现货延期交易的履约，再满足询价交易的履约。清算交割顺序在前的 交易所得资金和实物可用于顺序在后交易的资金清算与实物交割。
spdb9940	由交易所按相关程序操作。 
spdb9947	国际中心制 定
spdb9948	“集中、净额、分级”
spdb9949	是指交易所对会员统一办理资金清算和划付；
spdb9950	是指会员就其在交易所买卖的成交差额与交易所进 行清算； 
spdb9957	仅限于托管在国际中 心指定托管机构的债券。
spdb9958	除库存 类、外币类、债券类以外其他的可用于充抵保证金业务的有价资 产。
spdb9967	为规范国际投资者的交易行为，保护国际投资者的 合法权益
spdb9968	《上海黄金交易所章程》、《上海黄金交易所现货 交易规则》、《上海黄金交易所国际会员管理实施细则》及其他相 关业务细则和《上海国际黄金交易中心有限公司章程》
spdb9969	依法在中华人民共和国境外（含港澳 台地区）或交易所认可的其他地区登记注册的，经交易所审核批 准在交易所从事贵金属交易的特别会员。
spdb9970	通过具备代理业务资格的国际会员代 理进入交易所交易的投资者。
spdb9977	为规范在上海黄金交易所（以下简称交易所）托管的黄金、 铂金、白银等实物租借行为，维护租借双方的合法权益
