spdb8050	要牢固树立五大发展理念，紧密结合上海发展实际，解放思想，锐意改革，扩大开放，勇于创新，坚定不移推进供给侧结构性改革。总的要求是：紧紧围绕提升供给体系的质量和效率全面深化改革，紧密结合中国（上海）自由贸易试验区和建设具有全球影响力的科技创新中心的国家战略实施，紧密结合上海经济转型升级的根本要求，以制度创新为核心，以科技创新为引领，以结构调整为主攻方向，以降低企业成本和补齐薄弱环节短板为重点任务，坚定不移、有力有效推进供给侧结构性改革。主要目标是：通过推进供给侧结构性改革，进一步促进要素优化配置和自由流动，进一步激发各类市场主体活力，着力增强供给结构对需求变化的适应性，提高全要素生产率，更好地满足人民群众物质文化生活和生态环境需要，继续当好全国改革开放排头兵和创新发展先行者。
spdb8057	各分支机构重点部门、重点岗位
spdb8058	“优先恢复对外服务”的原则，明确应急处置流程和现场处置权限。
spdb8059	及时掌握汛情变化
spdb8060	应急资金支付和业务畅通，各级国库要加强与政府、财政等部门沟通，提前了解掌握可能发生的各类应急支付需要。
spdb8077	为贯彻落实国务院印发的《中国（上海）自由贸易试验区总体方案》
spdb8078	《进一步深化中国（上海）自由贸易试验区改革开放方案》（编号是国发〔2015〕21号）
spdb8079	围绕营造法治化、国际化、便利化的营商环境和公平、统一、高效的市场环境，使市场在资源配置中起决定性作用和更好发挥政府作用，着力解决市场体系不完善、政府干预过多和监管不到位等问题，深入推进简政放权、放管结合、优化服务改革，努力做到放得更活、管得更好、服务更优。围绕构建权责明确、公平公正、透明高效、法治保障的事中事后监管体系，改革监管体制、创新监管模式、强化监管手段，探索建立以综合监管为基础、以专业监管为支撑的监管体系，构建市场主体自律、业界自治、社会监督、政府监管互为支撑的监管格局，全面提升开放条件下的公共治理能力，切实提高事中事后监管的针对性、有效性，使市场和社会既充满活力又规范有序。
spdb8080	监管补短板。  3.坚持制度创新。发挥浦东综合
spdb8087	（一）引导市场主体自律  筑牢市场主体自律的第一道防线，对市场机制可以解决的问题交由市场解决，促使市场自我约束、自我净化。  1.强化市场主体责任。建立完善市场主体首负责任制，促使市场主体在安全生产、质量管理、营销宣传、售后服务、信息公示等方面加强自我监督、履行法定义务。  2.创新市场评价机制。鼓励支持电子商务等互联网平台企业为交易当事人提供公平、公正、透明的信用评价服务，客观记录并公开交易与消费评价信息，促进市场参与各方加强自我约束。  3.发挥金融机构的市场制约作用。
spdb8088	2.创新市场评价机制。鼓励支持电子商务等互联网平台企业为交易当事人提供公平、公正、透明的信用评价服务，客观记录并公开交易与消费评价信息，促进市场参与各方加强自我约束。  3.发挥金融机构的市场制约作用。
spdb8089	1.支持行业协会和商会发展。推动行业协会商会建立健全行业经营自律规范、自律公约和职业道德准则，规范会员行为。建立政府与行业协会商会间的信用信息互联共享机制。通过政府购买服务等方式，支持行业协会商会开展行业信用评价工作，建立健全企业信用档案，完善行业信用体系。探索将航运保险等贴近市场的金融创新的审核和监管职能，下放至金融同业公会等市场组织机构，发挥互联网金融协会等组织在行业规范发展方面的重要作用。  2.建立新型业界自治平台。深化上海自贸试验区社会参与委员会改革试点。以陆家嘴法定机构试点为突破，组建陆家嘴金融城理事会，探索在事中事后监管各个环节建立业界参与机制，发挥在权益保护、资质认定、纠纷处理、失信惩戒等方面的作用。
spdb8090	既要鼓励“四新”经济等创新发展，又要探索适合其特点的审慎监管方式，量身定制监管模式。  4.完善市场退出机制。对违反法律法规禁止性规定或者达不到节能环保、安全生产、食品药品、工程质量等强制性标准的市场主体，依法进行查处，情节严重的，依法吊销相关证照。简化和完善企业注销流程，试行对个体工商户、未开业企业以及无债权债务企业实行简易注销程序。加强食品药品、安全生产、建筑工程等领域违法人员从业禁止管理。  5.促进行政与司法衔接。建立健全行政机关与法院、检察院等司法机关之间的信息共享、案情通报和协调合作机制，完善案件移送标准和程序，细化并严格执行执法协作相关规定。。
spdb8098	为贯彻落实《国务院关于创新重点领域投融资机制鼓励社会投资的指导意见》（国发〔2014〕60号）、《国务院办公厅转发财政部发展改革委人民银行关于在公共服务领域推广政府和社会资本合作模式指导意见的通知》（国办发〔2015〕42号）等文件要求
spdb8099	有利于充分发挥市场机制作用，提升公共产品和服务的供给质量和效率，实现公共利益最大化。
spdb8100	合作伙伴选择方式、项目投资计划及融资方案、项目前期工作、运营和服务等内容
spdb8107	《实施办法》有关要求，于近年内完成研发并已投入实施和运用一年以上，且创新性突出、经济和社会效益显著、行业引领示范作用明显、风险防控措施到位；对于创新性较强、在短期内已经取得显著经济社会效益的项目，年限要求可适当放宽。
spdb8108	登陆上海金融创新奖申报平台（http://sjr.sh.gov.cn:8040/），在平台上注册后进行在线申报，按要求填写项目概要、申报单位意见和项目创新实施情况报告等。
spdb8127	依托电子口岸公共平台建设国际贸易单一窗口，推进单一窗口免费申报机制”、“国际海关经认证的经营者（AEO）互认制度”、“出境加工监管”、“企业协调员制度”、“原产地签证管理改革创新”、“国际航行船舶检疫监管新模式”、“免除低风险动植物检疫证书清单制度”等7项。
spdb8128	入境维修产品监管新模式”、“一次备案，多次使用”、“委内加工监管”、“仓储货物按状态分类监管”、“大宗商品现货保税交易”、“保税展示交易货物分线监管、预检验和登记核销管理模式”、“海关特殊监管区域间保税货物流转监管模式”等7项。
spdb8137	上海市金融服务办公室、中国人民银行上海总部、上海银监局、上海证监局、上海保监局支持，新华社上海分社、新华社中国经济信息社、新华社新闻信息中心、中国金融信息中心、新华网、上海证券报、上海金融业联合会、第一财经
spdb8138	为了加强上海证券交易所（以下简称本所）分级基金业务管理，保障分级基金业务平稳运作，保护投资者合法权益
spdb8140	折算包括定期份额折算和不定期份额折算。
spdb8147	依托上海自贸试验区、张江国家自主创新示范区的改革平台，充分发挥“双自联动”优势，推进人才政策先行先试，构建人才、智力、技术、资金、管理、服务等创新要素高度集聚的国际人才试验区。建立上海自贸试验区海外人才离岸创新创业基地，探索区内注册、海内外经营的离岸模式，打造具有引才引智、创业孵化、专业服务保障等功能的国际化综合性创业平台。依托企业、高校、科研院所和产业园区，新建一批市级海外高层次人才创新创业基地，试点建立与国际规则接轨的高层次人才招聘、薪酬、考核、科研管理、社会保障等制度，打造若干“学科（人才）特区”。推动设立张江科技银行等现代科技投资金融机构，开展针对科技型中小企业的金融服务创新，支持高层次人才创新创业。
spdb8148	实行更积极、更开放、更有效的海外人才引进政策，更大力度实施“千人计划”，进一步完善专项资金管理制度及科研、工作、生活配套完善政策，重点引进全球一流的科学家、创意家、创业家。健全工作和服务平台，建立“千人计划”人选进入政府决策咨询专家组制度，探索建立“千人计划”人才更加灵活的岗位聘用制度，充分发挥“千人计划”人才的作用。完善“千人计划”宣传机制、评价机制和资助机制，打造具有上海特色的海外高层次人才引进品牌。“十三五”期间，重点引进一批能够突破关键技术、引领新兴学科、带动新兴产业发展的海外高层次人才，推进上海“千人计划”建设，争取一批人才入选中央“千人计划”。
spdb8149	着眼于人才基础性培养和战略性开发，持续保持和提升本市人才竞争力，每年遴选一批管理、专业技术、创业等领域的优秀青年人才进行重点开发。在高校、科研院所及领军型科技企业建设一批青年英才培养基地。加大对杰出青年科技人才资助力度，培养一大批具有国际视野、创新活力、成长潜力的优秀青年科研人才。到2020年，培养造就一支能够在建设具有全球影响力的科技创新中心、建设“四个中心”和社会主义现代化国际大都市过程中发挥重要作用的高素质青年英才队伍。不断完善优秀大学生选调项目，吸引优秀应届大学毕业生从事公共管理工作。
spdb8150	鼓励引导企业设立首席技师工作室和完善首席技师制度，对企业推进首席技师培养计划及建立首席技师工作室给予经费资助。到2020年，新资助一批在行业中处于领先地位、对产业发展有突出贡献的市级、国家级技能大师工作室和技艺精湛、引领作用突出的首席技师。依托上海先进制造业和现代服务业重点领域，推进高技能人才培养（实训）基地建设，设立一批新型学徒制试点单位。引导企业建立健全职工技能培训制度，深入推进高师带徒、校企合作等项目。
spdb8158	要从落实人才强国战略、创新驱动发展和上海国际金融中心建设的高度，深刻认识人才工作的重要性和紧迫性。要坚持以科学的人才观指导人才工作，树立“聚天下英才而用之”的理念，以海纳百川的胸怀、“近悦远来”的环境吸引集聚人才；树立“人人皆可成才”理念，科学评价人才，培养培育优秀人才；树立“人人尽展其才”理念，用其所长、用当其时。要不断优化金融人才工作体制机制，始终坚持党管人才原则，始终坚持国际化、市场化方向，始终坚持多方联动的工作机制
spdb8159	要认真贯彻落实金融系统人才工作会议各项目标任务，进一步加强金融人才队伍建设，不断开创金融人才工作新局面，为上海国际金融中心建设作出更大的贡献。
spdb8167	为全力配合上海国际金融中心建设
spdb8168	媒体评审、网络投票和专家评审。
spdb8169	于业明 太平洋资产管理公司 董事长、总经理  戎志平 中国金融期货交易所 副总经理  宋安平 上海期货交易所 理事长  陈　兵 上海国际信托 总经理  陈　林 华宝证券 董事长  李道滨 中银基金 董事、执行总裁  郑志扬 交通银行上海市分行 行长  顾建忠 上海国际集团 董事、副总裁；金浦产业投资基金 董事长  焦瑾璞 上海黄金交易所 理事长  阙　波 上海证券交易所 副总经理
spdb8170	方蔚豪 平安租赁 董事长、CEO  李　文 汇添富基金 董事长  沈建峰 北京银行上海分行 行长  陈　勇 中国大地保险 总经理  张晓萌 花旗银行上海分行副行长  倪建达 易居金融集团董事长；钜派投资集团联席 董事长、CEO  徐　菲 上海市再担保有限公司 董事长  顾清良 浙商银行上海分行 行长  陶永平 中国长城资产管理公司 运营总监；上海办事处总经理  康慧珍 华侨永亨银行(中国) 执行董事、CEO  注：以上名单按姓氏笔划排序
spdb8177	人才资本和技术要素贡献占比较高的转制科研院所、高新技术企业、科技服务型企业开展员工持股试点
spdb8178	试点；违反国有企业职工持股有关规定且未按要求完成整改的企业，不得开展员工持股试点；未纳入试点的国有控股企业，不得自行组织实施员工持股。
spdb8180	统筹平衡、成熟一户开展一户
spdb8187	监管机构一级企业的外部市场
spdb8190	统筹平衡、成熟一户开展一户
spdb8197	由住宅工程的建设单位投保的，保险公司根据保险条款约定，对在保修范围和保修期限内出现的由于工程质量缺陷所导致的投保建筑物损坏，履行赔偿义务的保险。
spdb8198	住宅建设工程质量潜在缺陷保险合同的被保险人、受益人或索赔权益人，在发生保险合同约定的保险事故向保险公司提出索赔时，合同各方当事人应予遵守的各项规定。
spdb8199	依法享有索赔权利的保险合同的被保险人、受益人或索赔权益人。
spdb8200	同一物业管理区域内依法成立的物业管理企业。
spdb8207	为推动金融创新，防范金融风险，提高工作效率，由中央在沪金融管理单位推出的新的措施。  （二）经济和社会效益显著（应用性）  能够带来显著的经济和社会效益，提升金融服务社会经济的功能，特别是在加快转变经济发展方式、保障和改善民生、推动科技自主创新、便利中小企业融资、保护金融消费者权益等方面作出较大贡献，获得权威部门和社会的普遍认可。  （三）引领示范作用明显（示范性）  具备行业代表性和全国领先优势，对金融业发展有较大引领示范作用，推动上海国际金融中心建设效应显著。  (四)风险控制水平良好（安全性）  已经形成对信用风险、市场风险、操作风险等系统内外各种风险充分识别和有效控制的金融风险防范机制，可有效预防、回避、分散或转移相关金融创新产品的风险，形成良好的自我风险控制能力。。
spdb8208	（一）不违反国家金融监管法规和政策的有关规定；  （二）权属、合法性等方面不存在争议；  （三）未获得过其他省（部）级以上奖励；  （四）于近两年内完成研发，并已投入实施和运用一年以上；对于创新性较强、在短期内已经取得显著经济社会效益的项目，年限要求可适当放宽。
spdb8209	（一）评审工作领导小组办公室对申报材料进行形式审查。对不符合要求的材料，申报单位应在5个工作日内补正。对逾期未补正或经补正后仍不符合要求的，不提交专家评审组。  （二）专家评审组召开评审会议，申报单位按照规定进行答辩。专家评审组通过评分，提出拟奖励项目和获奖等级建议。  （三）对拟奖励项目进行公示。
spdb8210	上海金融创新奖获奖项目和获奖单位，由市政府发文通报表彰，并颁发获奖证书和奖励资金。
spdb8217	鼓励证券公司、基金管理公司、私募基金管理机构、商业银行、保险公司等市场主体及其管理的产品投资绿色公司债券，探索
spdb8218	研究发布绿色公司债券指数，建立和完善绿色公司债券板块。
spdb8219	系统单位应当加强政策支持和引导，建立审核绿色通道，适用“即报即审”政策，提升企业发行绿色公司债券的便利性；
spdb8220	绿色债券公益榜”，将证券公司承销绿色公司债券情况作为证券公司分类评价中社会责任评价的重要内容
spdb8228	为贯彻落实党中央、国务院决策部署，对照国际最高标准、最好水平的自由贸易区，全面深化自贸试验区改革开放，加快构建开放型经济新体制，在新一轮改革开放中进一步发挥引领示范作用
spdb8229	以开放促改革、促发展、促创新；进一步加强与上海国际金融中心和具有全球影响力的科技创新中心建设的联动，不断放大政策集成效应，主动服务“一带一路”建设和长江经济带发展，形成经济转型发展新动能和国际竞争新优势；更大力度转变政府职能，加快探索一级地方政府管理体制创新，全面提升政府治理能力；发挥先发优势，加强改革系统集成，力争取得更多可复制推广的制度创新成果，进一步彰显全面深化改革和扩大开放试验田作用。
spdb8230	《全面深化中国（上海）自由贸易试验区改革开放方案》的建设目标是到2020年，率先建立同国际投资和贸易通行规则相衔接的制度体系，把自贸试验区建设成为投资贸易自由、规则开放透明、监管公平高效、营商环境便利的国际高标准自由贸易园区，健全各类市场主体平等准入和有序竞争的投资管理体系、促进贸易转型升级和通关便利的贸易监管服务体系、深化金融开放创新和有效防控风险的金融服务体系、符合市场经济规则和治理能力现代化要求的政府管理体系，率先形成法治化、国际化、便利化的营商环境和公平、统一、高效的市场环境。强化自贸试验区改革同上海市改革的联动，各项改革试点任务具备条件的在浦东新区范围内全面实施，或在上海市推广试验。
spdb8237	深化推进金融中心与科技创新中心建设相结合
spdb8238	一是服务贸易承保领域扩展取得新突破，在原有的软件外包、工程咨询、油田钻井等6大领域的基础上，新拓展了医药行业，进一步实现服务贸易领域承保多元化；二是为中国企业提供国际营销网络支持取得新突破，保险机构利用自身成熟的海外平台帮助企业建立海外营销网络；三是跨境电商业务承保取得新突破，通过保险产品创新，首次实现对宝钢集团跨境电商销售平台——欧冶国际电商有限公司的承保。
spdb8240	为贯彻落实党中央、国务院决策部署，对照国际最高标准、最好水平的自由贸易区，全面深化自贸试验区改革开放，加快构建开放型经济新体制，在新一轮改革开放中进一步发挥引领示范作用
spdb8247	深化实施全国海关通关一体化、“双随机、一公开”监管以及“互联网+海关”等举措，进一步改革海关业务管理方式，对接国际贸易“单一窗口”，建立权责统一、集成集约、智慧智能、高效便利的海关综合监管新模式。综合应用大数据、云计算、互联网和物联网技术，扩大“自主报税、自助通关、自动审放、重点稽核”试点范围。深化“一线放开”、“二线安全高效管住”改革，强化综合执法，推进协同治理，探索设立与“区港一体”发展需求相适应的配套管理制度。创新加工贸易出口货物专利纠纷担保放行方式。支持海关特殊监管区域外的企业开展高附加值、高技术、无污染的维修业务。深入实施货物状态分类监管，研究将试点从物流仓储企业扩大到贸易、生产加工企业，具备条件时，在上海市其他符合条件的海关特殊监管区域推广实施。
spdb8248	完善进口商品风险预警快速反应机制，加强进口货物不合格风险监测，实施消费品等商品召回制度。建立综合应用合格评定新机制，设立国家质量基础检验检疫综合应用示范园区。在制定发布不适用于第三方检验结果采信目录清单基础上，积极推进扩大商品和项目的第三方检验结果采信。探索扩大检验鉴定结果国际互认的范围。
spdb8249	2016年十大优秀应用”奖
spdb8250	全日制、全过程监管、全过程留痕
spdb8257	一是健全自律机制，增强自律工作的依法合理合规
spdb8258	一是健全自律机制，增强自律工作的依法合理合规；二是健全查处机制，规范从业人员行为及市场秩序
spdb8259	一是健全自律机制，增强自律工作的依法合理合规；二是健全查处机制，规范从业人员行为及市场秩序；三是健全投诉调解机制，依法高效化解保险纠纷；
spdb8260	一是健全自律机制，增强自律工作的依法合理合规；二是健全查处机制，规范从业人员行为及市场秩序；三是健全投诉调解机制，依法高效化解保险纠纷；四是健全跨行业合作机制，创新推进反保险欺诈工作；
spdb8267	（一）完善的股东（大）会、董事会（执行董事）、监事会（监事）、管理层的议事制度和决策程序；  （二）明确的股东、董事、监事和经理的权利、义务；  （三）面向全体股东的完善的财务信息公开制度。
spdb8268	（一）机构的名称住所、经营范围、注册资本等；  （二）股东（大）会、董事会（执行董事）、监事会（监事）以及管理层的产生、职权、议事规则等；  （三）法定代表人由董事长、执行董事或者总经理担任；  （四）《中华人民共和国公司法》列明的及股东（大）会会议认为需要规定的其他事项。
spdb8269	（一）决定机构的经营方针和投资计划；  （二）选举和更换由非职工代表担任的董事、监事；  （三）审议批准董事会（执行董事）、监事会（监事）的报告；  （四）对机构增加或减少注册资本作出决议；  （五）修改公司章程；  （六）《中华人民共和国公司法》列明的及公司章程规定的其他职权。
spdb8270	（一）执行股东（大）会决议；  （二）制定机构的经营计划、投资方案、重大资产处置方案和基本管理制度，决定机构内部管理机构的设置，其中经营计划应包括但不限于业务目标、经营模式、分支机构的设立等内容；  （三）决定聘任或解聘机构的高级管理人员、财务负责人；  （四）制定机构增加或减少注册资本的方案；  （五）《中华人民共和国公司法》列明的及公司章程规定的其他职权。
spdb8277	（一）董（理）事简历及其履职情况；  （二）监事简历及其履职情况；  （三）高级管理人员简历、职责及其履职情况；  （四）董（理）事、监事、高级管理人员年度报酬情况。
spdb8278	（一）责令改正；  （二）监管谈话；  （三）将其违规行为记入履职记录，进行行业通报；  （四）依法可以采取的其他监管措施。
spdb8280	（管理层讨论和分析）应当重点阐述报告期内的产品经营情况、赔付支出情况、财务运营情况、资金运用情况、准备金提取情况、偿付能力情况、关联交易情况、重大风险评估分析及其他重要事项。
spdb8287	协助处理上海金融官网、上海金融官微、上海金融人才网等平台的金融资讯发布、专题信息策划、舆情分析研究、重点工作课题研究等相关工作
spdb8288	本科三、四年级或硕士研究生二、三年级在读学生，经济、金融、管理、新闻传播等相关专业，会摄影摄像，责任心强，踏实肯干，具有良好的理解、沟通、协调和执行能力，有新媒体运营经验者优先。
spdb8289	协助处理信息化项目设计方案论证、官方网站建设运维、技术支持
spdb8290	本科三、四年级或硕士研究生二、三年级在读学生，计算机、软件工程、网络信息安全等相关专业，熟悉ps、矢量图等主流图片处理及java语言和html5编程技术，责任心强，踏实肯干，具有良好的理解、沟通、协调和执行能力
spdb8297	银行业金融机构要建立贯穿债券交易各环节、覆盖全流程的内控体系，加强债券交易的合规性审查和风险控制。坚持“穿透管理”和“实质重于形式”的原则，将债券投资纳入统一授信。。
spdb8298	银行业金融机构应将直接债券投资以及通过特殊目的载体（SPV）、表外理财等方式开展的债券投资纳入统一监测范围，全面掌握资金真实投向和底层债券资产的基本信息、风险状况、交易变动等情况，实现准入集中、数据集中和退出集中管理。
spdb8299	银行业金融机构要审慎开展委外投资业务，严格委外机构审查和名单管理，明确委外投资限额、单一受托人受托资产比例等要求，规范开展债券回购和质押融资，严格控制交易杠杆比率，不得违规放大投资杠杆。
spdb8300	高度关注债券集中到期的企业、出现债券违约的企业，防控债券违约风险向信贷业务传导。各级监管机构要督促风险管理能力薄弱、债券投资占比高的银行合理控制持债余额。
