spdb6079	UCP500等国际惯例，及时、妥善处理，确保信用，无正当理由不得延付或拒付信用证。
spdb6080	为规范银行信用证业务，维护我国金融体系对外形象和银行信誉
spdb6087	加强对金融机构的监督管理，充分发挥会计师事务所的鉴证和服务作用
spdb6089	加强对引进无形资产的售付汇管理
spdb6090	1.专利实施许可合同；  　　2.国家专利局颁发的专利实施许可合同备案《回执》；  　　3.国家专利局颁发的《专利广告证明》；  　　4.外经贸部及其分支机构颁发的《技术引进和设备进口合同注册生效证书》。
spdb6099	为规范全国银行IC卡密钥管理
spdb6100	现将《关于加强农村信用社电子化建设和管理的指导意见》印发给你们，请各地农村信用社联社总结检查前段有关电子化建设的情况，根据当前实际，对照本次印发的指导意见，制定和完善本地农信社加强电子化建设的规划，解决存在的问题。
spdb6107	是指保险公司的指标值必须在规定的指标值以内，否则即违反有关法律法规，监管部门将视其情节轻重及造成的影响给予处罚并责令其纠正。
spdb6108	监测各类保险公司的偿付能力和保险公司财务状况
spdb6109	是指保险公司的指标值以在设定的范围内为宜，如果超过设定的范围，并不一定表示保险公司有违规行为或财务状况恶化，但监管部门要对该公司进行跟踪调查，结合其他相关指标综合分析，必要时可要求该公司作出合理的解释。
spdb6110	适用于中资保险公司和中外合资保险公司，外资保险公司分公司和再保险公司可参照适用。各级监管部门在指标使用过程中不能机械运用指标测算，还需要结合当地保险公司的实际情况区别使用。
spdb6118	为进一步加强对农村信用社机构的管理，提高农村信用社监管工作的制度化和规范化水平
spdb6120	为进一步规范外汇转贷款业务，防范和化解外汇转贷款业务风险，保护转贷机构的合法权益
spdb6127	为进一步发展货币市场，拓宽基金管理公司与证券公司的投资和融资渠道
spdb6128	为了进一步发挥农村金融机构在支持农业和农村经济发展中的作用，适当增加农业贷款总量，合理调整贷款结构，切实提高贷款质量，发展农村经济，增加农民收入，扩大农村市场，根据国务院要求和赴农村实地调查情况
spdb6129	为适应银行卡异地跨行信息交换业务的需要
spdb6130	为了加强反假人民币工作，调动有关单位和个人反假币工作的积极性，有力打击制贩假币犯罪活动，总行对1995年颁布的《反假人民币奖励办法（试行）》（银发〔1995〕141号）进行了修改。
spdb6137	携带人应到原签发《携带证》的银行开具证明文件，然后凭此文件及有关材料到该银行所在地外汇局审核，经审核无误后，外汇局向携带人出具核准文件。银行凭外汇局核准文件补办《携带证》。除此之外，其他情况一律不予补办。
spdb6139	为贯彻《中华人民共和国外汇管理条例》，完善境内居民个人外汇管理
spdb6157	为认真贯彻《中华人民共和国行政处罚法》和《罚款决定与罚款收缴分离实施办法》
spdb6158	为规范外资银行的外部审计工作
spdb6160	（1）债务人经法院判决或仲裁机构裁决获得或通过变卖各种资产、财产等形式获得的人民币收入；  　　（2）债务人通过改善经营和财务状况获得的除人民币贷款以外的人民币收入；  　　（3）债务人获得的其主办银行在总行批准的统一授信额度内发放的人民币贷款收入。外汇局在办理此项业务时，应要求贷款银行提供其总行关于统一授信的证明文件、贷款银行对该债务人的授信证明。外汇局应与中国人民银行有关司局进行核对。
spdb6168	为支持和督促金融机构依法收贷收息，改善金融机构的资产质量。
spdb6169	为使银行信贷登记咨询制度管理制度化、规范化
spdb6177	“非法金融机构和非法金融业务活动由中国人民银行予以取缔。非法金融机构设立地或者非法金融业务活动发生地的地方人民政府负责组织、协调、监督与取缔有关的工作”。
spdb6178	中国人民银行发现金融机构为非法金融机构或非法金融业务活动开立账户、办理结算和提供贷款的，应当责令该金融机构停止有关业务活动。任何单位和个人不得擅自动用有关资金”。
spdb6180	清理信贷资产、改进贷款分类方法，是建立现代金融制度的重要内容之一，是防范和化解金融风险的重大措施。这项工作对改善各政策性银行、商业银行信贷管理，提高中央银行监管水平具有重大意义。
spdb6187	一些商业银行、城乡信用社、信托投资公司等
spdb6188	（一）1993年7月《中共中央、国务院关于当前经济情况和加强宏观调控的通知》（中发〔1993〕6号）发布以后，各年度特别是1997年全国金融工作会议以后发生、尚未支付的高息揽存金额、利率水平，并逐笔登记造册。（二）高息揽存的具体表现。（三）发生高息揽存的责任归属，谁应负领导责任，谁是直接责任者。对上述问题，要如实报告当地人民银行并立即纠正和处理。
spdb6197	应首先向对外贸易经济合作部授权的部门申请援外合资合作基金外汇贷款，或者向中国进出口银行申请援外优惠外汇贷款，外汇贷款不足的，可列出用汇清单，经对外贸易经济合作部批准后，方可向外汇局申请购汇。
spdb6198	项目单位应持对外贸易经济合作部授权部门签发的海外企业批准证书、援外任务书、对外贸易经济合作部授权部门的借款批复或项目单位与中国进出口银行签订的贷款协议等向外汇局申请，经外汇局核准后，到外汇指定银行购汇支付。
spdb6208	将更名申请报告及章程修改草案等文件一并报人民银行省分行审核，经批准后，持人民银行省分行介绍信，到总行换领《金融机构法人许可证》
spdb6209	中国人民银行金融统计数据归口管理
spdb6210	统计数据的外资银行指《中华人民共和国外资金融机构管理条例》规定的外国银行分行、外资银行、合资银行、外资财务公司和合资财务公司
spdb6217	大额外币存款利率由金融机构与客户协商确定。300万（含300万）以上美元或等值其他外币的大额外币存款，其利率水平由金融机构与客户协商确定，并报当地人民银行备案。各级人民银行要加强监测分析和管理，防止高利吸储。今后，大额外币存款起存金额由中国银行业协会负责调整。
spdb6218	为了适应银行卡业务发展的需要，推动银行卡业务联合工作的深入和顺利开展
spdb6219	银行卡业务发展的普遍经验，也是“金卡工程”建设的主要目标。
spdb6220	缺乏统一的业务、技术标准和管理规范，造成城市中心的机构名称、管理体制不统一，业务做法不规范等问题。
spdb6227	可以对外售（付）汇的贸易方式”、“有条件对外售（付）汇的贸易方式”和“不得对外售（付）汇的贸易方式”三类报关单，报关单联网核查系统中已有不同的显示颜色或提示，以示区别。外汇管理局及外汇指定银行应注意识别。
spdb6228	由政府部门、企事业单位及个人等委托人提供资金，由商业银行（即受托人）根据委托人确定的贷款对象、用途、金额、期限、利率等代为发放、监督使用并协助收回的贷款。
spdb6239	吸收公众存款的金融机构法人（简称金融机构法人）受市场其他参与者的委托，为其办理债券结算等业务的行为。
spdb6240	（1）以委托人名义为委托人在中央国债登记结算有限责任公司（简称中央结算公司）办理债券托管账户开户、销户等手续；（2）根据委托人的指令，为其办理有关结算手续；（3）在债券利息支付和本金兑付中，为委托人办理相关事宜。
spdb6250	在核销单备注栏注明“此出口属于境外带料加工装配项目”
spdb6257	从境外汇入的外汇资金、境内商业银行的合法现汇存款以及从事B股交易所获得的外汇，支出范围为汇出境外、存入其在境内开立的合法外汇账户以及从事B股交易需支付的外汇。
spdb6258	从境外汇入的外汇资金、境内商业银行的合法现汇存款以及从事B股交易所获得的外汇，支出范围为汇出境外、存入其在境内开立的合法外汇账户以及从事B股交易需支付的外汇。
spdb6259	专项报表中依据属地原则将邮政储蓄存款划分为城市、县（县级市）、县以下三部分；活期储蓄存款中包括定活两便存款和通知存款；储蓄存款等于活期储蓄存款与定期储蓄存款数据之和；存款总和等于城市、县（县级市）、县以下三类机构数据之和；合计数据应等于分地区数据之和。专项报表格式详见附表。。
spdb6260	专项报表以书面形式及与书面形式相同的文本文件或EXCEL电子表格文件形式上报。
spdb6267	原则上不设分支机构。由于集团改组导致法人机构改为分支机构的，个案处理。
spdb6268	严格限定在成员单位之间。原已开办此项业务的财务公司，需继续办理的，应重新报中国人民银行批准，并按要求予以规范。
spdb6269	为筹集中长期资金，支持企业技术改造，满足资产负债比例监管指标要求，各财务公司可申请发行财务公司债券。人民银行各分行、营业管理部应做好辖内财务公司发行债券前期准备工作。
spdb6277	满足固定资产投资和流动资金需求
spdb6279	应是无条件、不可撤销、不可转让、对借款人人民币债务本金及其相关利息和费用承担连带责任的书面担保。
spdb6280	制定完善的信用风险控制制度，并自行对提供信用保证的外资银行的履约能力进行评估。
spdb6287	“但不得跨行转存”。
spdb6288	“第四条第一款第二款”改为“第四条第二款”
spdb6289	为完善国有独资商业银行外汇业务服务功能，促进其外汇业务的稳健发展
spdb6290	由中国人民银行分行、营业管理部负责审批国有独资商业银行分支机构新开或增开外汇业务的申请。
spdb6297	无赔款优待”时，必须出具上年该车辆无索赔记录的保单正本。
spdb6299	上年内该机动车辆无赔款，亦可享受“无赔款优待”，但必须同时出具上年清洁保单和前一家保险公司的无赔款证明。
spdb6307	为简化经常项目外汇结汇审核手续，提高工作效率
spdb6317	“先分开业务、后分开企业、再分离资金”
spdb6320	接受境内机构违反国家外债和对外担保管理法规的借款和担保申请，向境内机构放款、接受境内机构提供的未经外汇局批准的对外担保。
spdb6330	1.完税证明及税务申报单（享受减免税待遇的企业应提供当地税务管理部门出具的减免税证明文件）；  　　2.由会计师事务所出具的本年度利润或股息、红利情况的审计报告；  　　3.董事会关于利润或股息、红利分配的决议；  　　4.外商投资企业外汇登记证；  　　5.会计师事务所提供的验资报告；  　　6.外汇局要求提供的其他材料。
spdb6347	在境外发行股票的企业在境内开立外汇股票专用账户，应当持规定的材料向所在地外汇局申请，由所辖外汇局分局审核批准。
spdb6348	（1998）21号文《关于加强资本项目外汇管理若干问题的通知》第三条第三款第三项修改为：“境外发行股票，境内发行B股所筹外汇资金结汇
spdb6349	“企业调回的股票发行收入，如需在境内开立外汇账户，须向所在地外汇局申请，经所辖外汇局各分局批准后，方可开立外汇专用账户存储。申请时，应提交由企业法人代表或董事会授权人签署并加盖公章的开户申请书，以及本通知第一条所述的外汇局同意其在境外开立账户的批准文件，申请书应包括开户理由、币种、金额、收支范围、使用期限、拟开户行等有关内容。”
spdb6357	为充分发挥中小企业在吸纳下岗职工、实施再就业工程中的作用，商业银行要按照“鼓励兼并、规范破产、下岗分流、减员增效、实施再就业工程”的要求和国务院的有关规定，通过改进金融服务积极支持再就业工程。对积极吸纳国有企业下岗职工的中小企业、劳动就业服务企业和下岗职工从事个体经济或组织起来兴办经济实体的，只要符合国家产业政策、产品适销对路，符合贷款条件，有关商业银行和信用社要积极给予贷款支持，城市商业银行和城市信用社要优先安排此类贷款。
spdb6368	为充分运用信贷杠杆
spdb6369	不仅严重制约了经济增长质量的提高和产业结构的优化，也极大影响了银行信贷资产质量。
spdb6377	原则上不得超过人民银行规定的一年期存款利率
spdb6380	核销呆账超过呆账准备金余额部分，应在税后利润中提取呆账准备金补足，否则原则上不得对股东分红。
spdb6387	为加强住房公积金财务管理，维护住房公积金所有者的合法权益，规范住房公积金管理中心的财务行为
spdb6389	为了简化外商投资企业技术引进购付汇管理手续，现对《关于加强对引进无形资产售付汇管理有关问题的通知》［（98）汇管函字第092号］（以下简称《通知》）作如下补充规定：
spdb6399	按收费最低限收取
spdb6400	为促进住房消费，支持住房产业成为新的经济增长点，改善银行信贷资产结构
spdb6408	效益性、安全性、流动性
spdb6409	由商业银行按照《中华人民共和国商业银行法》和《贷款通则》的有关规定给予贷款支持，主管部门可提出项目建议，由商业银行自主贷款；不符合商业贷款条件的，主管部门如能落实贴息或其他补贴形式，使之符合商业贷款条件，银行也可继续发放贷款。商业银行要在符合商业贷款的前提下，统筹安排资金，解决遗留问题，减少贷款和项目的损失。
spdb6410	由商业银行按照《中华人民共和国商业银行法》和《贷款通则》的有关规定给予贷款支持，主管部门可提出项目建议，由商业银行自主贷款；不符合商业贷款条件的，主管部门如能落实贴息或其他补贴形式，使之符合商业贷款条件，银行也可继续发放贷款。商业银行要在符合商业贷款的前提下，统筹安排资金，解决遗留问题，减少贷款和项目的损失。
spdb6417	商业银行应当建立有效的信息交流和反馈机制，确保董事会、监事会、高级管理层及时了解本行的经营和风险状况，确保每一项信息均能够传递给相关的员工，各个部门和员工的有关信息均能够顺畅反馈。
spdb6418	按照规定及时、真实、完整地披露会计、财务信息，满足股东、监管当局和社会公众对其信息的需求
spdb6420	内部人员和内外勾结，利用计算机或侵入计算机网络，盗窃银行资金。
spdb6438	可胜任人民币真伪鉴定的业务人员。
spdb6439	《中国人民银行授权书》分为正文部分和说明部分。正文部分为授权内容，说明部分为对公众的告知内容
spdb6447	1.是否与出纳部门有价单证领用登记簿的有关数字核对相符；  　　2.是否与本部门有价单证领用登记簿核对相符。
spdb6448	1.是否与业务部门领用登记簿有关数字核对相符；  　　2.是否与有价单证销号单（簿）核对相符；  　　3.是否发现多缺漏页错号现象。
spdb6449	1.是否与出纳库房的待销毁有价单证保管登记簿核对相符；  　　2.是否与会计部门待销毁有价单证表外科目余额核对相符。
spdb6450	1.是否与重要空白凭证保管登记簿核对相符；  　　2.是否与重要空白凭证表外科目有关账户余额核对相符。
spdb6457	JR/T　0008—2000《银行卡发卡行标识代码及卡号》 　　JR/T　0009—2000《银行卡磁条信息格式和使用规范》 　　以上标准自2001年1月1日起实施。
spdb6460	本人存放于境内商业银行的外汇存款（包括外汇钞户和外汇汇户）
spdb6470	1.自费留学人员到银行办理预交人民币保证金前，应当持因私普通护照、境外机构预交外汇保证金通知书等向户籍所在地国家外汇管理局分支局（以下简称“外汇局”）提出申请。 　　2.经外汇局核准后，自费留学人员应持外汇局核准件和购汇相关凭证到银行办理预交人民币保证金手续和购付汇手续。 　　3.银行在办理预交人民币保证金购汇业务时，具体手续按照中国银行总行制定的《境内居民个人出国留学购汇预交人民币保证金操作规程》有关规定办理
spdb6477	包括中资商业银行、外资独资银行、中外合资银行
spdb6478	真实性、准确性、完整性和可比性的原则，规范地披露信息。
spdb6479	第九条商业银行财务会计报告由会计报表、会计报表附注和财务情况说明书组成
spdb6480	资产负债表、利润表（损益表）、所有者权益变动表及其他有关附表。
spdb6487	为了发展国内资本市场，为境内居民个人合法外汇持有者增加投资渠道。
spdb6497	（一）依据有关法律、行政法规设立的企业法人。 　　（二）具有独立、完整的会计财务核算部门和制度。 　　（三）具有合格的经营管理人员。 　　（四）具有一定的注册资本（金）。专营店注册资本金不得少于100万元；兼营黄金制品零售业务的大中型综合商场注册资本金不得少于500万元。 　　（五）具有固定的营业场所和符合安全条件的库房。专营店营业场所面积不得少于60平方米。兼营黄金制品零售业务的大中型综合商场营业面积应不低于3000平方米，其中经营黄金制品零售业务场所面积不得低于40平方米。 　　民族地区专营或兼营黄金制品零售业务的资金和营业面积可根据上述原则适当放宽。
spdb6498	（一）经营黄金制品零售业务的申请报告。 　　（二）企业决策层的决议。 　　（三）企业名称预先核准通知书（新设企业提交）或企业营业执照复印件（已设企业提交） 　　（四）营业用场所所有权或使用权的证明。 　　（五）企业法定代表人或企业负责人身份证明；会计、出纳员资格证明；经营黄金制品业务人员的简历。 　　（六）人民银行认可机构开具的验资证明、银行开户证明。 　　（七）会计核算方法和会计科目设置情况的说明。
spdb6499	十四、经营单位销售的黄金制品，必须盖有生产企业的戳记代号和含金量标记，并配有标签牌，注明生产厂家、重量及含金量。含金量千分数不小于999的称为千足金，应打千足金印记或按实际含量打印记；含金量千分数不小于990的称为足金，应打足金印记或按实际含量打印（GOLD999或G990）；含金量百分数小于99的称为K金，应打K金数印记或按实际含量打印记（K金饰品含金量每K为4.15%）。
spdb6508	为加强对计算机病毒的预防和治理，确保银行计算机信息系统安全
spdb6519	凭发票或支付清单等相关凭证，从其外汇账户中支付，不得购汇支付。
spdb6520	向境外支付国际海运运费及相关费用，以及向境内的货代公司、船代公司、船运公司和外商独资船务公司划转的国际海运运费及相关费用。
spdb6527	（一）具备健全且运行良好的组织机构；      （二）具有持续盈利能力，财务状况良好；      （三）最近三年财务会计文件无虚假记载，无其他重大违法行为；      （四）经国务院批准的国务院证券监督管理机构规定的其他条件。
spdb6529	为了确立中国人民银行的地位和职责，保证国家货币政策的正确制定和执行，建立和完善中央银行宏观调控体系，加强对金融业的监督管理
spdb6537	为加强信贷管理，提高贷款质量，防止大案要案的发生
spdb6547	修改为：“银行或者其他金融机构的工作人员吸收客户资金不入帐，数额巨大或者造成重大损失的，处五年以下有期徒刑或者拘役，并处二万元以上二十万元以下罚金；数额特别巨大或者造成特别重大损失的，处五年以上有期徒刑，并处五万元以上五十万元以下罚金。”
spdb6550	为了认真贯彻落实国务院关于《对储蓄存款利息所得征收个人所得税的实施办法》，加强储蓄存款利息所得个人所得税的征收管理
spdb6557	为规范商业银行柜台记账式国债交易行为，方便投资人买卖记账式国债，维护投资人的合法权益，促进债券市场的健康发展
spdb6559	为了保护商业银行、存款人和其他客户的合法权益，规范商业银行的行为，提高信贷资产质量，加强监督管理，保障商业银行的稳健运行，维护金融秩序，促进社会主义市场经济的发展
spdb6560	依照本法和《中华人民共和国公司法》设立的吸收公众存款、发放贷款、办理结算等业务的企业法人。
spdb6567	（一）发布与履行其职责有关的命令和规章；  （二）依法制定和执行货币政策；  （三）发行人民币，管理人民币流通；  （四）监督管理银行间同业拆借市场和银行间债券市场；  （五）实施外汇管理，监督管理银行间外汇市场；  （六）监督管理黄金市场；  （七）持有、管理、经营国家外汇储备、黄金储备；  （八）经理国库；  （九）维护支付、清算系统的正常运行；  （十）指导、部署金融业反洗钱工作，负责反洗钱的资金监测；  （十一）负责金融业的统计、调查、分析和预测；  （十二）作为国家的中央银行，从事有关的国际金融活动；  （十三）国务院规定的其他职责。
spdb6569	要求银行业金融机构按照规定的比例交存存款准备金；  （二）确定中央银行基准利率；  （三）为在中国人民银行开立账户的银行业金融机构办理再贴现；  （四）向商业银行提供贷款；  （五）在公开市场上买卖国债、其他政府债券和金融债券及外汇；  （六）国务院确定的其他货币政策工具。
spdb6570	执行有关存款准备金管理规定的行为；  （二）与中国人民银行特种贷款有关的行为；  （三）执行有关人民币管理规定的行为；  （四）执行有关银行间同业拆借市场、银行间债券市场管理规定的行为；  （五）执行有关外汇管理规定的行为；  （六）执行有关黄金管理规定的行为；  （七）代理中国人民银行经理国库的行为；  （八）执行有关清算管理规定的行为；  （九）执行有关反洗钱规定的行为。
spdb6577	为了惩治骗购外汇、逃汇和非法买卖外汇的犯罪行为，维护国家外汇管理秩序
spdb6587	安全生产设施或者安全生产条件不符合国家规定，因而发生重大伤亡事故或者造成其他严重后果的，对直接负责的主管人员和其他直接责任人员，处三年以下有期徒刑或者拘役；情节特别恶劣的，处三年以上七年以下有期徒刑。”
spdb6588	举办大型群众性活动违反安全管理规定，因而发生重大伤亡事故或者造成其他严重后果的，对直接负责的主管人员和其他直接责任人员，处三年以下有期徒刑或者拘役；情节特别恶劣的，处三年以上七年以下有期徒刑。
spdb6589	在安全事故发生后，负有报告职责的人员不报或者谎报事故情况，贻误事故抢救，情节严重的，处三年以下有期徒刑或者拘役；情节特别严重的，处三年以上七年以下有期徒刑。
spdb6590	“依法负有信息披露义务的公司、企业向股东和社会公众提供虚假的或者隐瞒重要事实的财务会计报告，或者对依法应当披露的其他重要信息不按照规定披露，严重损害股东或者其他人利益，或者有其他严重情节的，对其直接负责的主管人员和其他直接责任人员，处三年以下有期徒刑或者拘役，并处或者单处二万元以上二十万元以下罚金。”
spdb6597	“依法负有信息披露义务的公司、企业向股东和社会公众提供虚假的或者隐瞒重要事实的财务会计报告，或者对依法应当披露的其他重要信息不按照规定披露，严重损害股东或者其他人利益，或者有其他严重情节的，对其直接负责的主管人员和其他直接责任人员，处三年以下有期徒刑或者拘役，并处或者单处二万元以上二十万元以下罚金。
