spdb3517	服务调查满意度100%。
spdb3518	（一）流程手续透明化。各营业网点将办理贷款条件、流程、执行利率、相关优惠政策及信贷员联系方式全部公开上墙，并在各行政村均设立公示牌，方便群众学习、掌握、办理。  （二）办理时限透明化。联社对贷款发放实行期限管理，符合贷款条件的，收回再贷3个工作日办结，新户贷款5个工作日内予以办结，对客户迫切的贷款特事特办，1个工作日内办结。同时，还推行每日八小时专人值班制，客户有贷款需求，可直接到贷款服务中心登记，且信贷员还主动上门服务。  （三）监督检查透明化。联社设置监督台、意见簿、开通投诉邮箱，公开投诉电话，方便社会监督
spdb3527	一是坚决打好防范化解金融风险攻坚战。坚持稳中求进工作总基调，有序推进降低企业杠杆率、拆解影子银行、严厉打击非法金融活动、遏制房地产泡沫化倾向、配合整顿地方政府隐性债务等工作，加强对各类风险的防范和化解。二是更好支持现代化经济体系建设。围绕供给侧结构性改革，加强与地方和企业的联系协调，推动结构调整和兼并重组，支持市场化法治化债转股。提升差异化服务能力，有力支持乡村振兴、区域协调和创新驱动等国家重大战略实施。进一步做实普惠金融，督促引导银行保险金融机构回归本源、专注主业，继续改进小微、“三农”金融服务。三是深化银行保险体系改革开放。引导银行保险金融机构健全公司治理，积极探索有中国特色的现代金融企业制度，全力推动银行保险业向高质量发展转变。进一步扩大对外开放，研究落实对外开放新举措，以开放促改革，激发市场活力，推动形成银行保险业全面开放新格局。。
spdb3528	会议审议了有关银行业防范化解金融风险攻坚战、强化银行不良资产认定和处置、提高大中型商业银行普惠金融事业部服务能力等重要文件。
spdb3529	为了落实改革过渡期融合工作要求
spdb3540	是三江之源、“中华水塔”，是国家生态安全的制高点和平衡点，具有无法替代的重要战略地位。在三江源头大力发展“水塔”金融，支持保护好中华民族的精魂血脉，是青海银行业发展的最大价值、最大潜力和最大责任之所在。发展“水塔”金融，关键是要坚持以生态文明理念统领银行业改革发展稳定，核心是通过大力倡导和推广绿色信贷，不断调整和优化信贷结构，有效促进绿色经济、低碳经济、循环经济发展和节能减排，努力防范环境与社会风险，实现国家绿色发展战略、青海生态立省战略与银行转型发展战略的有机统一，实现支持地方经济发展与防范金融风险的有机统一，实现优化经济结构和优化信贷结构的有机统一。
spdb3549	一是对接政府规划。围绕黄河三角洲农业高新区、济南产业金融中心建设等重大项目，加大对经济增长新动能行业和基础设施建设支持力度，新增政府主导类授信项目百余个，累计新增授信额度327亿元。二是对接行业转型升级。围绕钢铁去产能和减煤减排，向产能调整项目授信95亿元，支持关停企业生铁及粗钢生产。大力发展绿色金融，累计投放世行转贷业务融资1.66亿，支持高耗能工业企业节能减排。三是对接企业“去杠杆”。探索运用产业基金等模式，降低企业资产负债率。
spdb3559	四川银监局派出一名副局长参加省委蹲点督查小组赴凉山州布拖县开展蹲点调研，其间做了以下工作，对布拖县“五个一”扶贫机制落实、17个扶贫
spdb3567	对全市节能环保及战略性新兴产业、工业转型升级项目的信贷支持情况。
spdb3568	深圳银监局鼓励辖内银行加强对战略性新兴产业企业特点、资金运作模式的研究，在推广传统产品的同时，加大供应链融资、并购贷款等产品创新，通过提供个性化产品，既满足企业的差别化金融需求，又能有效分散信贷风险，帮助企业降低财务成本，提高资金使用效率。
spdb3569	深圳银监局利用各种场合积极引导银行履行社会责任，要求银行充分发挥在金融资源配置中的重要作用，抓住战略性新兴产业发展机遇，细化相关产业的信贷政策，加快调整信贷结构，明确将六大新兴产业作为优先支持对象，促进深圳产业结构的升级。
spdb3577	加强风险排查、摸清底数，多措并举严控不良增量、处置不良存量，有效遏制不良贷款“双升”态势。
spdb3578	农合机构要主动适应从严从紧的监管要求，主动贯彻落实监管部门工作部署，主动加强与监管部门的沟通汇报，严格执行重大事项报告制度，出台的重大经营决策、规章制度办法、高管任职等事项要提前与监管部门进行正式沟通，认真做好“一排二查三治理”等专项工作的自查和配合工作，真正实现回归本源、专注主业。
spdb3587	银行业金融机构应积极贯彻落实“一带一路”战略，为企业走出去和国际产能合作提供优质金融服务。在风险可控、商业可持续的前提下，结合自身服务企业走出去的战略定位，主动对接重点领域重大境外项目建设，支持基础设施互联互通、国际产能合作和经贸产业合作区建设。
spdb3588	银行业金融机构应围绕走出去企业的有效需求，加强有利于提高服务质量和效率、与自身风险管控能力相匹配的金融创新，拓展国际化融资模式，积极开展出口信贷、项目融资、银团贷款、贸易金融、投资银行、跨境人民币业务、金融市场、全球现金管理、资产管理、电子银行、金融租赁等相关金融服务。
spdb3589	银行业金融机构应建立健全涵盖境外机构与业务的公司治理原则和框架，明确相应授权和责任，建立科学合理的决策、执行、监督、激励、问责等治理运行机制，提高内部控制的有效性，确保境外机构和业务发展符合自身整体战略。
spdb3590	银行业金融机构应持续提升全面风险管理能力，加强与境外机构和业务有关的战略风险、信用风险、市场风险、合规风险、国别风险、环境与社会风险、流动性风险以及操作风险的管理。高度重视综合经营带来的跨境跨业风险，健全覆盖所有境外机构与业务的并表管理框架。
spdb3600	“三个完善”确保支持到位。三地银行业在高温时节除积极争取并贯彻落实各类惠农措施外，着力建立保障农业生产的长效机制。一是完善考核激励机制。嘉兴海盐联社等多家农村法人机构为保障高温时节农业生产，将农户贷款纳入绩效考核范围，奖惩力度远高于公司贷款和小微企业贷款。二是完善调查走访机制。为对农户种植、销售等进行有效的定性分析和定量测评，泰隆银行湖州分行运用“三品三表”调查模式，将数字化的“硬”信息和社会化的“软”信息有机结合，深入了解农户高温时节资金季节性需求。三是完善结对互动机制。如农行湖州分行20个网点与当地村委党建结对，7月份举办座谈会等活动50场，开展座谈会等各类互动活动，及时了解当地农业生产情况。
spdb3607	督促各村镇银行在落实法人主体责任的基础上，逐步建立完善的体系内风险救助机制，充分发挥体系性互助作用。在沪13家村镇银行均与发起行签订了流动性支持协议，并做好临时流动性便利额度和流动性救助安排。
spdb3608	梳理有关案件风险防控、操作风险管理制度及要求，发送村镇银行，作为案防和操作风险防控业务辅导资料。
spdb3617	一是帮助农民融入互联网经济。四地农信机构创新“丰收驿站”模式，为农村提供集小额存取款、缴费充值、线上线下代购代售、快递收发等金融服务，同时为每家“丰收驿站”配备站长，用“一根网线、一台电脑、一个屏幕”为村民提供接地气的服务。目前，四地农商行已建立丰收驿站760个，单点每月平均业务量达250笔。二是帮助民工工资按时足额支付。
spdb3627	一是有力支持基础设施和重点项目建设。
spdb3628	各项贷款比年初增加2115.65亿元，同比多增26.05亿元，同比增长13.51%，高于全国0.71个百分点。
spdb3629	同比增长15.54%，高于各项贷款增速2.03个百分点
spdb3630	贷款8211.74亿元，占各项贷款四分之一以上；在监测的397个重点关注行业中，福建省银行业支持产业转型升级贷款1458.74亿元，比年初增加434.8亿元，增幅高达42.46%
spdb3638	侴宇明希望渤海银行太原分行和中国移动山西公司在校园客户深度捆绑、龙城单车网点与渤海银行自助银亭联动、渤海银行白金卡客户与移动VIP客户资源共享等方面
spdb3639	两公司本着优势互补、资源共享、合作共
spdb3640	在数据传输、信息化建设、移动商务、电子商务、代收代缴等方面
spdb3650	电子渠道和收单业务为抓手，带动了双方在IC联名卡、电子商务、特惠折扣系统等多个方面合作
spdb3659	加强保险销售人员的执业管理，及时为保险销售人员办理和注销执业登记
spdb3670	为适应新形势下商业银行表外业务发展出现的新变化和新趋势，进一步引导商业银行表外业务规范发展，加强商业银行表外业务风险管理
spdb3678	为推动珠江西岸先进装备制造产业带加快建设
spdb3697	厦门工行积极运用互联网思维，精心策划各类专项营销体验活动，推进社会化营销，借力大数据分析客户行为特征开展精准营销，加快推进互联网金融的战略布局
spdb3698	要重点关注思维、产品、客户体验和营销四个维度，重视目标客户的定位分析、风险控制和可能带来的信贷模式变化
spdb3699	厦门工行顺应移动互联网发展趋势，完善网点互联网环境建设，以拳头产品为主打，抢占移动金融市场。
spdb3700	厦门工行大力发展融e购电商平台，积极拓展辖内大型优质客户，组织O2O体验社会化营销等，精心打造互联网金融品牌。
spdb3707	一要深刻理解“两学一做”学习教育两个特点。二要准确把握“基础在学”的主体内容，坚持问题导向，紧密联系实际，使学习讨论系统化、深入化。三要准确把握“关键在做”的根本要求，使学习教育贴地而行、接地气。四要坚持学做结合。贯彻落实“两学一做”精神，稳步推进二季度各项中心工作。
spdb3709	各银行业金融机构普遍成立了打击治理电信网络新型违法犯罪专项工作领导小组，明确分工，落实责任，协同配合，形成日常工作机制，确保该项工作常抓不懈。
spdb3710	全面落实银监会《关于银行业打击治理电信网络新型违法犯罪有关工作事项的通知》相关要求，限制同一客户开立借记卡原则上不超过4张，同一代理人代理开卡原则上不超过3张。二是筛查清理存量银行卡，加强客户身份信息核实，通过与公安联网核查反馈信息比对，筛查假名、借名银行卡，做好个人客户信息采集和补录工作，确保信息真实完整。2016年以来，防堵利用伪冒证件开户8起。
spdb3718	督导银行主动让利，降低融资成本，严禁附加不合理的贷款条件，并免收抵押登记费和公证费等。
spdb3719	引导银行针对不同小微企业经营风险情况，开展年审制微贷、无还本续贷、准抵押等弱担保贷款，提高小微金融服务的可得性和满足度。。
spdb3720	一是切实增强对突发事件的处置能力，做好各级网点的稳控工作，尤其是震中区域网点要做好从业人员思想维稳和工作协调；二是密切关注客户情绪，积极进行疏导，及时处置可能造成连锁影响的情况，必要时启动应急预案。
spdb3728	弥补监管短板 提升监管效能的通知》（以下简称《通知》）,进一步提升监管有效性，防范化解金融风险，促进银行业安全稳健运行。
spdb3729	强化监管制度建设、强化风险
spdb3738	是指债务人或第三方为担保商业银行相关债权实现，抵押或质押给商业银行，用于缓释信用风险的财产或权利。
spdb3739	合法性原则。押品管理应符合法律法规规定。 （二）有效性原则。抵质押担保手续完备，押品估值合理并易于处置变现，具有较好的债权保障作用。 （三）审慎性原则。充分考虑押品本身可能存在的风险因素，审慎制定押品管理政策，动态评估押品价值及风险缓释作用。 （四）从属性原则。商业银行使用押品缓释信用风险应以全面评估债务人的偿债能力为前提。
spdb3740	押品真实存在； （二）押品权属关系清晰，抵押（出质）人对押品具有处分权； （三）押品符合法律法规规定或国家政策要求； （四）押品具有良好的变现能力。
spdb3747	上海银行与上海市担保基金积极开展业务创新，推出“银税保”、“投贷保”、“专精特新企业”、“文创保”和“EN贷”等专项产品方案，并开通绿色审批通道，为优质成长型中小企业提供“结算、理财+信贷+政策性担保+投贷联动”等综合金融服务。
spdb3749	  二是精准扶贫。。
spdb3750	金融服务全覆盖。  三是将“双基联动”发展成金融精准扶贫的好平台。银政共同参与金融扶贫，银行业机构借助地方财政担保基金，实现扶贫贷款的数倍放大，有助于变“输血”式扶贫为“造血”式扶贫，在提高扶贫资金使用效率的同时，实现精准扶贫。  四是将“双基联动”打造成促进农村信用体系建设的新载体。“双基联动”开展后，银行业机构对农户的信用经济建档以及信用等级评定和贷款发放等都依托于村党组织的推荐意见，有利于增强农户的诚实守信意识，构建良好的农村信用环境探索“双基联动”模式，促进银政合作双赢。
spdb3757	为积极配合农业现代化发展的需要，乌苏市联社结合地方经济和民营企业现状，引进外部担保机构，突破小企业在抵押、担保等方面的“瓶颈”。该联社和乌苏市农机局及农机经销商签订三方合作协议，由农机经销商对农机贷款提供担保，并向乌苏市联社缴存10%的保证金。同时，由乌苏市农机局负责对全辖农机的补贴事宜，以及办理农机抵押登记手续。通过三方合作、明晰责任，三方有机形成合力，不但解决了农民申请贷款无合适抵押物和担保问题，同时由补贴和农机局担保作为双重保障，降低了银行的信用风险。截至2016年2月末，已累计发放购农机具贷款190户，金额5565.5万元。有力地支持了农业机械化水平，为农业现代化发展夯实了基础
spdb3758	三是给信用户及牧民优惠利率。在确定上浮利率时，降档执行，对养殖业少上浮5%，对既属于养殖业又是信用户减少上浮10%。截至2016年2月末，向2154户养殖信用户发放贷款40729.4万元。
spdb3760	一直积极贯彻落实党中央、国务院关于防控金融风险、弥补监管短板的决策部署，推进监管制度漏洞排查，坚决治理市场乱象，坚决打击违法行为。当前，银行业金融机构快速发展，社会资本发起设立、参股或收购银行业金融机构的积极性不断提高。但一些乱象也随之发生，如违规使用非自有资金入股、代持股份、滥用股东权利损害银行利益等。为治理上述市场乱象，切实弥补监管短板，银监会组织起草了《办法》。
spdb3770	是河北银监局及我省银行业机构贯彻落实“十九大”精神、践行“四个意识”、推进协同发展战略的重要举措，对推动雄安新区金融业发展具有里程碑意义，将进一步提高新区金融服务层级，对我省银行业机构及早对接新区金融需求、及早融入新区规划建设、及早实现创新转型发展具有重要实践意义。
spdb3777	小微企业、拓展融资渠道、优化融资方案、规范经营行为、推动专营机构改革和加强舆论宣传等六个方面，提出银行业金融机构为企业降低融资成本的具体指导意见，通过全方位、多渠道、针对性的措施，为银行业金融机构提升服务实体经济的质效提供
spdb3778	百色银行业以建设全国“南菜北送”生产基地为契机，大力支持冬菜种植及相关农业经营项目，成效显著。
spdb3780	百色银行业提升服务，通过优惠利率、简化小额农贷程序、设立绿色通道等措施，提升金融服务便捷度。
spdb3790	已具备区域统计、网点统计、网点查询、机构查询、模糊查询、综合查询等
spdb3798	一是加强对工程承包企业“走出去”的金融支撑。充分发挥保函的境外担保以及出口信贷的项目融资作用，为工程承包企业在前期招投标和后期项目运作中提供强有力的金融支撑。截至6月末，已开立的外币保函余额达10.41亿美元，涉及“一带一路”项目业务授信余额达36.71亿元。二是加强推进跨境双向人民币资金池业务。上半年累计为12家跨国企业集团办理跨境人民币资金归集调拨业务，协助14家跨国企业集团搭建跨境人民币双向资金池，助力辖区跨国企业人民币跨境双向流通。三是加强支持跨境直接投资业务。积极梳理辖区企业境外投资需求，助力省内多家企业进行海外并购。
spdb3809	南海农村商业银行联合五家企业共同发起设立了佛山海晟金融租赁股份有限公司，截至2017年6月末，该公司已支持装备制造行业发展的项目121个，并且与超过700家中小微企业达成主动授信。全力助推装备制造业产业转型升级。  
spdb3817	通过省政府对江苏苏银城投棚户区改造基金项目的统一规划、扎口管理，有效提高棚改项目的审核标准，控制各市县棚改项目的规模，避免盲目扩大。同时，各市县政府将购买棚改服务的资金纳入本级财政预算，若各市县未能按时支付服务费用，可由省财政厅在与其往来资金中直接扣款拨付，提升资金还款保证。
spdb3818	“银信政企”的合作模式，由省政府统一协调，融资成本为五年期以上贷款基准利率上浮10%，规模化投资提升资金利用效率，降低融资成本，减轻各级财政负担
spdb3829	督促辖内农村中小银行业机构大力开展合规教育活动，重点加强了从业人员对法律法规知识和“三十个严禁”的组织学习，让法规入脑入心，让合规成为习惯。。
spdb3830	组织辖内农村中小银行业机构对规章制度进行了修订完善，特别是对员工行为的约束性要求、对员工违规行为的举报制度、对员工违规行为的处罚办法等，进一步明确了员工行为的归口管理部门和主要职责，使大家行有规可依、为有章可循，对违规违纪现象处有纪可量、罚有尺可度。。
spdb3847	积极开通支付宝、银联在线、财付通“微信支付”服务
spdb3849	在网点安装网银验机设备，划分电子银行体验区，部分设立网购体验区。。
spdb3858	为进一步规范银行业金融机构从业人员行为，加强对银行业金融机构对其从业人员行为管理的监管
spdb3860	新疆银监局机关结对认亲活动以“手拉手心连心，结对认亲献真情”为主题，22名党员领导干部分别与和田县塔瓦库勒乡翁村、也克先拜巴扎村22户少数民族家庭结为亲人。结对认亲仪式上，新疆银监局局领导用维汉双语宣布了结对认亲名单，并给老乡和结对认亲干部们发放了用维汉双语书写的“新疆银监局结对认亲卡”。启动仪式结束后，新疆银监局22名党员领导干部深入认亲对象中走访并带去了米、面、油等慰问品
spdb3867	以其小额、信用、贴息
spdb3878	与省妇联、人社厅、财政厅、团委等部门
spdb3888	现场咨询、发放折页、有奖问答等
spdb3889	现场咨询、发放折页、有奖问答等
spdb3898	新疆银行业金融机构受宏观经济运行及内外部环境的复杂形势影响，不良贷款余额较年初新增47.63亿元，同比增长25.86%；不良贷款率为1.49%，同比上升0.19个百分点。
spdb3908	各级监管部门和银行业金融机构要认真学习领会中央农村工作会议和中央一号文件精神，认真贯彻落实全国银行业监督管理工作会议关于改善农村金融服务的各项工作要求，深刻认识“三农”问题始终是我国现代化建设进程中带有全局性和战略性的问题。要从全面建成小康社会、加快推进社会主义现代化的战略高度出发，强化支农服务政治责任，深入推进农村金融体制改革，主动适应农村实际、农业特点、农民需求，不断深化农村金融改革创新，健全金融支农制度，提升金融支农能力，推动金融资源继续向“三农”倾斜，实现农村金融与农业、农村经济的共同发展。2015年，要执行好现有各项农村金融服务政策和有扶有控的差别化信贷政策，不断加大“三农”信贷投放力度，在有效提高贷款增量的基础上，继续扩大“三农”专项金融债发行规模，努力实现涉农贷款增速高于全部贷款平均水平，充分发挥信贷资金对农业增产、农民增收和农村经济发展的推动效应。
spdb3909	强化农业发展银行政策性功能定位，明确政策性业务范围，加大对农业开发和水利、贫困地区公路等农业农村基础设施建设的贷款力度，审慎发展自营性业务。国家开发银行要创新服务“三农”融资模式，进一步加大对农业农村建设的中长期信贷投放。深化农村信用社改革，提高资本实力和治理水平，培育合格的市场主体，牢牢坚持立足县域、服务“三农”的定位，更好发挥支农服务主力军作用。强化农村信用社省联社服务功能，推动省联社加快职能转换，优化协调指导，整合放大农村信用社（农村商业银行、农村合作银行）服务“三农”的能力。引导邮政储蓄银行稳步发展小额涉农贷款业务，逐步扩大涉农业务范围，持续拓展农村金融业务，促进农村资金回流。支持其他商业银行下沉机构网点，优化农村地区网点布局，适度扩大农村地区网点覆盖面。
spdb3910	鼓励和引导汽车金融公司、消费金融公司在做好风险防范的基础上，不断加大对农村居民消费金融服务的支持力度，支持农村地区消费信贷发展，满足农村居民合理消费信贷需求，激发农村地区消费潜力，促进扩大内需和消费升级，发挥消费推动经济发展的基础作用。 积极推动省级人民政府抓紧落实对新型农村合作金融的监管、引导和规范职责，支持在符合条件的农民合作社和供销合作社基础上培育发展农村合作金融组织，促进其更好地为农村实体经济服务。
spdb3917	农行农行青岛分行将从扶持重点产业入手，大力支持县域重大基础设施项目、城镇化项目、水利水务项目、景区旅游项目、特色农业项目和商品流通市场等六类重点项目，以及机关事业单位、龙头骨干企业、优质小微企业、农业新型经营主体、个人贵宾客户和住房贷款客户等六类重点客户，打造产业优势，加快经济发展，促进广大农民从根本上实现脱贫致富目标。。
spdb3918	密切配合各级政府部门，主动对接脱贫攻坚方略、规划，利用好政府在信贷增信以及改善金融生态环境方面的举措，强化对贫困户的信贷服务。对于创业无资金、贷款无担保的贫困户，对接青岛市政府即将研究出台的扶贫小额贷款管理办法和针对贫困家庭设立的小额贷款基金，积极跟进农户贷款业务。配合市农委、市畜牧局、市海洋与渔业局等相关部门推广“企业+贫困户”、“合作社+贫困户”、“园区+贫困户”等模式，加快发展特色种养业，扶持贫困村培育一村一品，发展生态农业、观光农业和乡村旅游业，以农村特色产业带动农民脱贫致富。
spdb3919	文化水平、专业技能和综合素质长期不能提升，是导致农村贫富差距的重要原因。下步要继续采用送金融知识下乡等方式，结合农业新型经营主体培训班，有针对性地做好转移就业和农业创业培训，帮助贫困群众转变观念，增强信心，提高就业创业增收的能力。对贫困辍学失学的儿童，密切跟踪扶持，帮助其顺利完成学业。
